{
  "schemaVersion": 1,
  "actionKey": "generatePlan.v1",
  "operationId": "0f2b6c1d8a934e7fb5c2d90e814a3f66",
  "sourceAttemptId": "1a2b3c4d5e6f708192a3b4c5d6e7f809",
  "taskBindingId": "task-binding-digest",
  "chatDocumentId": "chat-document-id",
  "interactionId": "9e8d7c6b5a493827161504f3e2d1c0b9",
  "stage": "impl",
  "resumeSemantics": "sameOperation",
  "inputSnapshot": {
    "canonicalJson": "{\"advisoryRevision\":\"v1:120:99:7\",\"stage\":\"plan\",\"targetArtifact\":\"plan.md\"}",
    "sha256": "95943b6d997eb4b47fb4670eb0f91e87e66eda4335b5f84682690e67942679f5"
  },
  "promptContract": {
    "contractId": "ensemble-ai-result-contract",
    "contractVersion": 1,
    "promptInputSha256": "dddddddddddddddddddddddddddddddddddddddddddddddddddddddddddddddd"
  },
  "questions": [
    {
      "questionId": "scope",
      "kind": "singleChoice",
      "prompt": "Which artifact should the plan target?",
      "required": true,
      "options": [
        {
          "optionId": "plan",
          "label": "plan.md"
        },
        {
          "optionId": "task",
          "label": "task.md"
        }
      ]
    },
    {
      "questionId": "notes",
      "kind": "text",
      "prompt": "Anything else the plan must honor?",
      "required": false,
      "allowBlank": true,
      "maxLength": 500
    }
  ],
  "questionSetSha256": "226968aa12e7e510872785ffd06a010bf8b186f7693f8067731c47ae8ca62ce1",
  "answers": [
    {
      "questionId": "scope",
      "kind": "singleChoice",
      "state": "answered",
      "selectedOptionId": "plan"
    },
    {
      "questionId": "notes",
      "kind": "text",
      "state": "skipped"
    }
  ],
  "answerIdempotencyId": "aaaabbbbccccddddeeeeffff00001111",
  "answersSha256": "f9c32ec1d7edf43a417b75a217c5bb9a6bb4e8000b6d138244f80369f0085ded",
  "resumeIdempotencyId": "22223333444455556666777788889999",
  "state": "settled",
  "settlement": "resumed",
  "resumeResolution": {
    "kind": "sameOperation",
    "newAttemptId": "abcdefabcdefabcdefabcdefabcdef01"
  },
  "resumeInvocationClaimedAt": "2026-07-26T10:20:00.000Z",
  "resumeInvocationOutcome": {
    "kind": "completed",
    "correlation": {
      "actionKey": "generatePlan.v1",
      "operationId": "0f2b6c1d8a934e7fb5c2d90e814a3f66",
      "attemptId": "abcdefabcdefabcdefabcdefabcdef01",
      "taskBindingId": "task-binding-digest",
      "chatDocumentId": "chat-document-id"
    },
    "code": "completed"
  },
  "transitions": [
    {
      "receiptId": "00000000000000000000000000000000",
      "from": null,
      "to": "invocationPending",
      "at": "2026-07-26T09:59:00.000Z"
    },
    {
      "receiptId": "01010101010101010101010101010101",
      "from": "invocationPending",
      "to": "questionsPosted",
      "at": "2026-07-26T10:00:00.000Z"
    },
    {
      "receiptId": "02020202020202020202020202020202",
      "from": "questionsPosted",
      "to": "answersDraft",
      "at": "2026-07-26T10:05:00.000Z"
    },
    {
      "receiptId": "03030303030303030303030303030303",
      "from": "answersDraft",
      "to": "answersSubmitted",
      "at": "2026-07-26T10:10:00.000Z"
    },
    {
      "receiptId": "04040404040404040404040404040404",
      "from": "answersSubmitted",
      "to": "resumeScheduled",
      "at": "2026-07-26T10:15:00.000Z"
    },
    {
      "receiptId": "05050505050505050505050505050505",
      "from": "resumeScheduled",
      "to": "settled",
      "at": "2026-07-26T10:20:00.000Z"
    }
  ]
}
